{
  "$schema": "http://json-schema.org/draft-07/schema#",
  "$id": "https://github.com/phamnghia57/Log-Anomaly-Explorer/docs/architect/contracts/cluster-record.schema.json",
  "title": "ClusterRecord",
  "description": "Hop dong du lieu giua clustering (Nam) va query-api / incident view (Nghia). Moi cum loi sau khi cham diem bat thuong duoc luu theo dinh dang nay.",
  "type": "object",
  "required": ["cluster_id", "score", "log_ids", "first_seen", "last_seen", "status"],
  "properties": {
    "cluster_id": {
      "type": "string",
      "description": "Dinh danh duy nhat cho mot cum loi tuong tu"
    },
    "signature": {
      "type": "string",
      "description": "Dac trung dung de nhom (vi du: message da chuan hoa hoac hash cua stack trace)"
    },
    "score": {
      "type": "number",
      "description": "Anomaly score - muc do lech so voi baseline tan suat lich su"
    },
    "log_ids": {
      "type": "array",
      "items": { "type": "string" },
      "description": "Danh sach id cac log thuoc cum nay, dung de Incident View truy ve trace/request"
    },
    "trace_ids": {
      "type": "array",
      "items": { "type": "string" },
      "description": "Danh sach trace_id duy nhat lien quan den cum, dung cho lien ket trace/request"
    },
    "first_seen": { "type": "string", "format": "date-time" },
    "last_seen": { "type": "string", "format": "date-time" },
    "status": {
      "type": "string",
      "enum": ["normal", "anomalous", "alerted"],
      "description": "normal: diem duoi nguong. anomalous: vuot nguong nhung chua gui alert. alerted: da gui alert"
    }
  },
  "additionalProperties": false
}
