[
  {
    "cluster_id": "ea0458d260b36a00",
    "signature": "Simulated connection failure: downstream dependency unreachable",
    "score": 5.0,
    "log_ids": [
      "7ccc76cf-ced7-4bdd-8aca-e32e261b3b79",
      "eb6f9c23-8eff-42c0-a1f2-826eaaf181b1",
      "ec049b29-e386-4c75-acab-82467b8f2a29",
      "f86d515e-6b7e-4a56-9348-97d35f045973",
      "6ce32965-ccbf-4c97-b4aa-c18631d43d36",
      "84bb7dc4-93c3-41c9-a3d8-d04f87710db8"
    ],
    "trace_ids": [
      "055e3680e3fc9b8974c772f248d34018",
      "157bc94abb17ef8dfeba120873d43f0b",
      "74608b2aaeded018b9cce63d2ec00349",
      "8c10a75d58275958003223ec071a4eb1",
      "a0e0cd7320d014f1b4b0886e07126088",
      "d24d6b7a2fa2688a6a119c4fc8b0638e"
    ],
    "first_seen": "2026-10-20T05:08:31.602119+00:00",
    "last_seen": "2026-10-20T05:08:31.956132+00:00",
    "status": "alerted"
  },
  {
    "cluster_id": "35e5ab14415f274a",
    "signature": "Simulated connection failure: downstream dependency unreachable",
    "score": 5.0,
    "log_ids": [
      "22a5ca97-5c66-4162-8467-ff36578c4467",
      "c248ab24-89b3-4acf-97e1-05534e12dc0a",
      "5b718102-4eb9-436d-9917-6e1392ecfd36",
      "aabc699c-c0a9-4c95-ae7b-4f1a2f0e150f",
      "7d1c3bd8-e2ab-4014-a319-2956ee604c75",
      "d570763c-49f6-4a08-820b-6be255b57390"
    ],
    "trace_ids": [
      "1f10fba8f0960c1861e38680e524986b",
      "4b898e3ee20e53600cc67968ff2c24ff",
      "8a0e5289e1917d2e0382418524b6f7c3",
      "ad89baee7e453e11b2cf9056bb3627bb",
      "cf1c5fd493c49a2337e407e871ae9a99",
      "ea7c833e7f4dc29994028840b656b32d"
    ],
    "first_seen": "2026-10-20T05:08:33.219453+00:00",
    "last_seen": "2026-10-20T05:08:33.595561+00:00",
    "status": "alerted"
  },
  {
    "cluster_id": "1983a8d0b733cfad",
    "signature": "Simulated validation failure: required item data is invalid",
    "score": 5.0,
    "log_ids": [
      "cc776ca4-2dd6-4063-af59-1b14d0bc6738",
      "f797f96c-e591-45eb-af22-3e83a57305b5",
      "53b4f356-da64-44ab-b307-d30f6af6dda9",
      "c7287e99-fcba-49e6-9306-88628893dbaf",
      "0bedf5ae-63e0-4cf4-b2f7-1ae907c492ef",
      "e7b02749-d978-4727-b623-fcd444523878"
    ],
    "trace_ids": [
      "0da349f38948932e775d2b0d50d375ed",
      "3f283b11e7b0aeb37e3ce0cfe85e4816",
      "44d11dddc247678fdec8b3081611b15c",
      "7578ceb59ec0aabace98e8c4bcc1f2ba",
      "c81a2fbe73f7580604d84feb7130e1d7",
      "ee543c60a115e9735ba71d1aa7212441"
    ],
    "first_seen": "2026-10-20T05:08:31.057590+00:00",
    "last_seen": "2026-10-20T05:08:31.515193+00:00",
    "status": "alerted"
  },
  {
    "cluster_id": "7fd3a3db677a5138",
    "signature": "Simulated validation failure: required item data is invalid",
    "score": 5.0,
    "log_ids": [
      "8b5a330f-b922-4592-96de-8ae567883b27",
      "9af1fdbe-2bac-481f-a7ba-fe099f4e5216",
      "ec84d4de-df69-4698-9d9d-cdb45ad21358",
      "83bf780c-4a68-4e9c-9787-30ca392f1d65",
      "653c722f-3f81-4f6b-88a6-23137802d203",
      "7f4f2385-7311-4bc9-9957-4459589fd237"
    ],
    "trace_ids": [
      "3a69cfb7b073ab879eebc31107b16eab",
      "4a98f26f8521e613debaa99adc1b806b",
      "4fedc822defbee4c7057764178ac8158",
      "5f08f101c0d3c0685babc904ff910d39",
      "6c382dbea2972d6df2088b81de4d71e1",
      "b39b297a262b767709b1115b718a1343"
    ],
    "first_seen": "2026-10-20T05:08:32.491858+00:00",
    "last_seen": "2026-10-20T05:08:33.124888+00:00",
    "status": "alerted"
  },
  {
    "cluster_id": "62df1ba01c138dd1",
    "signature": "Simulated runtime failure",
    "score": 5.0,
    "log_ids": [
      "f35cf4d1-c47c-4418-90ae-7c634d120a45",
      "24c17aec-922d-4d43-8b3a-fe5aed2264d9",
      "7791870f-4fd2-412c-af39-9adb1f7ba28d",
      "d00490f7-b041-463a-9f6c-5a8a893072c6",
      "1e5bd203-44d2-4447-b93d-c55d16713a31",
      "eb0d2c07-6103-42e2-bf34-0771bbc607cb"
    ],
    "trace_ids": [
      "195139fafce035a70f81811dc14b1ff9",
      "513efe9257d796b661090adb5531e037",
      "90c28d573ddfabb8695dbee36b71a30f",
      "d7e819b5747898cc6afd81086bce1f9b",
      "dbd1c97a290c25b3b49256694fe14c6e",
      "fc1305d463639101fa9bbbf7745395ec"
    ],
    "first_seen": "2026-10-20T05:08:32.021689+00:00",
    "last_seen": "2026-10-20T05:08:32.426198+00:00",
    "status": "alerted"
  },
  {
    "cluster_id": "e395e422348e53c0",
    "signature": "Simulated runtime failure",
    "score": 5.0,
    "log_ids": [
      "9d93aa91-0099-49f1-bf1d-eb762b3af564",
      "843b80b3-85db-4924-898b-9d79b2e2bd16",
      "36b35971-8657-463e-8290-d1aa291930a3",
      "9d256547-9538-4b46-8ccb-39dbd5801e3b",
      "8d1c2b09-5d57-46e9-a5fe-64e74b5e7735",
      "ae787d0d-7df7-448e-aa19-43ddff8d3d17"
    ],
    "trace_ids": [
      "19703d113e591bbb79f97e8378bfdcf1",
      "2f781f1c6b54f26ab618e50d94fc57aa",
      "388a1a79030c5c0d1e0c15d34d26cbd1",
      "678c7a3c74ba3da75dae147177964478",
      "fb630316f72c5362e0f26941e8401d36",
      "fe6735eb21b2f5f6f6cdca0714c1311e"
    ],
    "first_seen": "2026-10-20T05:08:33.673486+00:00",
    "last_seen": "2026-10-20T05:08:34.002986+00:00",
    "status": "alerted"
  },
  {
    "cluster_id": "ea0458d260b36a00",
    "signature": "Simulated connection failure: downstream dependency unreachable",
    "score": 0.0,
    "log_ids": [
      "67d2fc16-ee9d-4ab2-ba2f-70ccbc5e7255"
    ],
    "trace_ids": [
      "ad1b80f05a14d9ef81a305d783687ce5"
    ],
    "first_seen": "2026-10-20T05:09:16.314863+00:00",
    "last_seen": "2026-10-20T05:09:16.314863+00:00",
    "status": "normal"
  },
  {
    "cluster_id": "1983a8d0b733cfad",
    "signature": "Simulated validation failure: required item data is invalid",
    "score": 0.0,
    "log_ids": [
      "b17540cd-645c-4df8-83b6-ba0b4e771d58"
    ],
    "trace_ids": [
      "d58c2786f7d51eb99dcbc749ce4d22f3"
    ],
    "first_seen": "2026-10-20T05:09:16.240261+00:00",
    "last_seen": "2026-10-20T05:09:16.240261+00:00",
    "status": "normal"
  },
  {
    "cluster_id": "7fd3a3db677a5138",
    "signature": "Simulated validation failure: required item data is invalid",
    "score": 0.0,
    "log_ids": [
      "2e464642-7567-4aa9-bb9b-40788f87775a"
    ],
    "trace_ids": [
      "88d7b7a7230b999ab53d41c7a0342f33"
    ],
    "first_seen": "2026-10-20T05:09:16.445343+00:00",
    "last_seen": "2026-10-20T05:09:16.445343+00:00",
    "status": "normal"
  },
  {
    "cluster_id": "62df1ba01c138dd1",
    "signature": "Simulated runtime failure",
    "score": 0.0,
    "log_ids": [
      "47e6be64-fd18-43b7-a5af-86195fe8fdf8"
    ],
    "trace_ids": [
      "123a75ff0e9c00ba6823c488c212c8b4"
    ],
    "first_seen": "2026-10-20T05:09:16.379472+00:00",
    "last_seen": "2026-10-20T05:09:16.379472+00:00",
    "status": "normal"
  },
  {
    "cluster_id": "35e5ab14415f274a",
    "signature": "Simulated connection failure: downstream dependency unreachable",
    "score": 0.0,
    "log_ids": [
      "fca2aac6-6bb9-43f5-8a2b-3b88da2dc129"
    ],
    "trace_ids": [
      "ca063cb55f78322ec7e267ffa424dacf"
    ],
    "first_seen": "2026-10-20T05:09:16.515780+00:00",
    "last_seen": "2026-10-20T05:09:16.515780+00:00",
    "status": "normal"
  },
  {
    "cluster_id": "e395e422348e53c0",
    "signature": "Simulated runtime failure",
    "score": 0.0,
    "log_ids": [
      "42344f9c-e50a-4ef4-86c8-bbc116230c8f"
    ],
    "trace_ids": [
      "fb08ef9fb3330aba9ce8d50ebbfeb688"
    ],
    "first_seen": "2026-10-20T05:09:16.589637+00:00",
    "last_seen": "2026-10-20T05:09:16.589637+00:00",
    "status": "normal"
  }
]