[
  {
    "cluster_id": "27da38d8fc4ca62e",
    "signature": "Payment timeout for order <NUM>",
    "score": 4.243,
    "log_ids": [
      "2-0",
      "2-1",
      "2-2",
      "2-3",
      "2-4",
      "2-5",
      "2-6",
      "2-7"
    ],
    "trace_ids": [
      "trace-2-0",
      "trace-2-1",
      "trace-2-2",
      "trace-2-3",
      "trace-2-4",
      "trace-2-5",
      "trace-2-6",
      "trace-2-7"
    ],
    "first_seen": "2026-10-01T09:02:10Z",
    "last_seen": "2026-10-01T09:02:10Z",
    "status": "anomalous"
  },
  {
    "cluster_id": "bb73d1237eab6beb",
    "signature": "User <NUM> not found",
    "score": 1.0,
    "log_ids": [
      "normal"
    ],
    "trace_ids": [
      "trace-2-7"
    ],
    "first_seen": "2026-10-01T09:02:10Z",
    "last_seen": "2026-10-01T09:02:10Z",
    "status": "normal"
  }
]
